{
  "$schema": "http://json-schema.org/draft-07/schema#",
  "title": "PrdDocument",
  "type": "object",
  "required": [
    "project_id",
    "title",
    "status",
    "sections",
    "open_questions"
  ],
  "properties": {
    "project_id": {
      "type": "string"
    },
    "title": {
      "type": "string"
    },
    "status": {
      "type": "string",
      "enum": [
        "draft",
        "review",
        "aligned",
        "frozen",
        "released",
        "archived"
      ]
    },
    "version": {
      "type": "string"
    },
    "owner": {
      "type": "string"
    },
    "links": {
      "type": "object",
      "additionalProperties": {
        "type": "string"
      }
    },
    "sections": {
      "type": "object",
      "properties": {
        "summary": {
          "type": "string"
        },
        "background": {
          "type": "string"
        },
        "problem": {
          "type": "string"
        },
        "goals": {
          "type": "array",
          "items": {
            "type": "string"
          }
        },
        "non_goals": {
          "type": "array",
          "items": {
            "type": "string"
          }
        },
        "target_users": {
          "type": "array",
          "items": {
            "type": "string"
          }
        },
        "scenarios": {
          "type": "array",
          "items": {
            "type": "string"
          }
        },
        "scope_in": {
          "type": "array",
          "items": {
            "type": "string"
          }
        },
        "scope_out": {
          "type": "array",
          "items": {
            "type": "string"
          }
        },
        "solution": {
          "type": "string"
        },
        "requirements": {
          "type": "array",
          "items": {
            "type": "string"
          }
        },
        "user_stories": {
          "type": "array",
          "items": {
            "$schema": "http://json-schema.org/draft-07/schema#",
            "title": "UserStory",
            "type": "object",
            "required": [
              "id",
              "persona",
              "need",
              "benefit",
              "acceptance_criteria"
            ],
            "properties": {
              "id": {
                "type": "string"
              },
              "persona": {
                "type": "string"
              },
              "need": {
                "type": "string"
              },
              "benefit": {
                "type": "string"
              },
              "story_statement": {
                "type": "string"
              },
              "acceptance_criteria": {
                "type": "array",
                "items": {
                  "type": "string"
                }
              },
              "priority": {
                "type": "string",
                "enum": [
                  "p0",
                  "p1",
                  "p2",
                  "p3"
                ]
              },
              "dependencies": {
                "type": "array",
                "items": {
                  "type": "string"
                }
              },
              "edge_cases": {
                "type": "array",
                "items": {
                  "type": "string"
                }
              }
            },
            "additionalProperties": false
          }
        },
        "metrics": {
          "type": "array",
          "items": {
            "type": "string"
          }
        },
        "risks": {
          "type": "array",
          "items": {
            "type": "string"
          }
        },
        "dependencies": {
          "type": "array",
          "items": {
            "type": "string"
          }
        },
        "launch_plan": {
          "type": "string"
        }
      },
      "additionalProperties": false
    },
    "open_questions": {
      "type": "array",
      "items": {
        "type": "string"
      }
    },
    "change_log": {
      "type": "array",
      "items": {
        "type": "string"
      }
    }
  },
  "additionalProperties": false
}