{
  "project_id": "fitness-app-mvp",
  "title": "健身 APP MVP：食物热量拍摄计算 + 组间歇闹钟 PRD",
  "status": "draft",
  "version": "v0.1",
  "sections": {
    "summary": "本 PRD 面向健身 / 减脂 / 训练辅助类 APP 的 MVP 立项与方案评审，聚焦两个核心能力：通过拍照识别食物并给出热量估算，以及在力量训练或间歇训练中提供组间歇计时提醒。目标是在最小范围内验证用户是否愿意持续使用“低门槛饮食记录 + 训练休息辅助”这两个高频工具能力，并为后续产品方向收敛提供依据。",
    "background": "当前业务处于早期立项阶段，已明确希望启动一款健身 APP MVP，但产品定位、首发平台、基础能力范围和信息架构尚未收敛。现有输入中，两个被反复强调的核心价值点是：一，降低记录食物热量的门槛；二，帮助用户在训练中按计划休息、减少手动看表和计时负担。结合现有信息，可判断首期并非要一次性建设完整健身产品，而是优先验证两个核心场景是否具备独立留存价值。当前证据以需求输入和场景假设为主，缺少用户访谈、竞品拆解和定量数据，因此文档应作为 review 版 PRD，用于收敛 MVP 边界，而非冻结版本。",
    "problem": "用户在饮食管理和训练执行中存在两类高频阻力。第一类是饮食记录成本高：传统热量记录往往要求用户手动搜索食物、选择份量、逐项录入，导致记录意愿低、持续性差。第二类是训练休息不规范：力量训练和间歇训练用户常依赖手表、手机秒表或主观估计控制休息时长，容易导致休息过长或过短，影响训练节奏。当前问题带来的直接障碍是：用户即便有减脂、增肌或训练计划，也很难稳定执行；如果产品不能用更低成本方式融入训练和饮食过程，则难以形成日常使用习惯。根因假设包括：现有记录路径输入过重、训练中操作不便、结果反馈不够即时，以及用户对“够用即可”的估算型工具接受度可能高于精确但复杂的流程。",
    "goals": [
      "验证用户是否愿意使用拍照估算热量替代部分手动饮食记录流程。",
      "验证用户是否愿意在真实训练过程中持续使用组间歇闹钟作为休息辅助工具。",
      "在 MVP 范围内搭建两个核心功能的基础入口、核心流程和最小数据埋点。",
      "为后续判断产品方向提供可量化的使用数据，包括拍照识别使用率、计时启动率和基础留存表现。"
    ],
    "non_goals": [
      "本期不建设完整的健身训练计划系统、动作库或课程内容体系。",
      "本期不承诺专业级营养精确计算，不覆盖复杂菜品拆分、长期营养分析和医学级建议。",
      "本期不建设完整账号体系、会员付费、多端同步和长期健康档案。",
      "本期不覆盖手表、耳机、语音教练等扩展硬件生态能力。"
    ],
    "target_users": [
      "希望降低饮食记录成本的泛健身用户。",
      "以减脂为主要目标、需要快速估算热量摄入的用户。",
      "进行力量训练、需要控制组间休息时长的用户。",
      "进行间歇训练、需要重复训练/休息倒计时提醒的用户。"
    ],
    "scenarios": [
      "用户在吃饭前或吃饭后拍摄食物照片，希望快速得到热量估算结果，而无需手动搜索输入。",
      "用户拍摄后对结果是否准确存在疑虑，希望看到明确的“估算值”提示，并能决定是否保存记录。",
      "用户在健身房进行力量训练时，在每组结束后启动休息倒计时，倒计时结束收到提醒后开始下一组。",
      "用户进行 HIIT 或其他间歇训练时，希望设置训练时长与休息时长，并重复获得提醒。",
      "用户希望用一个轻量工具减少训练和饮食中的操作负担，而不是进入复杂记录系统。"
    ],
    "scope_in": [
      "提供食物拍照入口，支持相机拍摄或从相册选择单张图片。",
      "调用识别/估算能力，返回食物名称或类别、估算热量结果及结果免责声明。",
      "支持用户保存一次拍照识别结果到本地或服务端基础历史中；若历史能力排期受限，则至少保留当次结果页与埋点。",
      "提供组间歇闹钟基础能力：可设置休息时长，开始、暂停、继续、结束倒计时，并在结束时触发声音或震动提醒。",
      "提供间歇训练基础模式：可配置训练时长、休息时长和循环组数，按顺序重复计时。",
      "提供清晰的信息架构入口，至少让用户能从首页或底部导航进入“饮食拍照”和“训练计时”两个功能。",
      "提供基础埋点，统计入口点击、拍照上传、识别成功/失败、结果保存、计时启动、计时完成等关键行为。",
      "在所有热量结果展示中明确说明结果为估算值，避免用户将其视为精准医疗或营养结论。"
    ],
    "scope_out": [
      "不支持复杂多食物餐盘的精细拆分与逐项营养素识别。",
      "不支持手动编辑食材明细、克重级份量调整和宏量营养素精确计算。",
      "不支持完整饮食日记、周报、月报和体重联动分析。",
      "不支持训练计划编排、动作切换联动、自动记录训练组数和负重。",
      "不支持锁屏小组件、智能手表联动、蓝牙耳机语音播报等扩展体验。",
      "不支持会员付费、社交分享、社区内容和个性化教练建议。"
    ],
    "solution": "方案采用双核心工具化设计，以最短路径验证两个高频场景。食物热量拍摄计算模块提供“拍照/选图—识别中—结果展示—可保存”的闭环，结果页展示识别到的食物类别、估算热量区间或单值，并突出“仅供估算参考”的文案；当识别失败或不确定时，返回可理解的失败提示，而不是静默报错。组间歇闹钟模块提供两种最小模式：一是单次休息倒计时，适合力量训练组间使用；二是训练/休息循环计时，适合间歇训练。整体产品层面建议采用极简导航：首页聚合两个主入口，避免在 MVP 阶段引入复杂体系。技术实现上，食物识别优先依赖第三方 AI 或现成数据库能力以缩短上线时间，计时模块优先保障前台可用和基础提醒稳定性；后台、锁屏和高可靠系统通知能力作为后续增强项。所有关键决策均需在评审中再次核实真实依赖、平台限制和数据口径后再冻结。",
    "requirements": [
      "系统必须提供食物拍照入口，支持调用移动端相机权限完成拍摄。",
      "系统应支持从相册选择单张图片进行热量估算，以覆盖非即时拍摄场景。",
      "用户提交图片后，系统必须展示识别处理中状态，避免无反馈等待。",
      "识别成功时，系统必须返回至少一个可读结果，包括食物名称/类别与估算热量值或区间。",
      "结果页必须展示免责声明，明确热量为估算结果，仅供饮食记录参考。",
      "识别失败、超时或结果不可信时，系统必须展示明确失败提示，并允许用户重试。",
      "MVP 阶段如无法保证高精度识别，系统不得使用“精准”“准确计算”等误导性文案。",
      "系统应支持用户保存本次热量估算结果；如历史能力未纳入首期，则至少完成保存按钮埋点和结果页停留分析。",
      "系统必须提供单次倒计时模式，允许用户设置休息时长并开始计时。",
      "单次倒计时模式下，系统必须支持开始、暂停、继续和提前结束操作。",
      "倒计时结束时，系统必须通过声音、震动或系统通知中的至少一种方式提醒用户。",
      "系统应提供循环计时模式，允许用户设置训练时长、休息时长和循环次数。",
      "循环计时模式下，系统必须在训练阶段和休息阶段切换时给出清晰状态提示。",
      "系统必须在计时过程中展示剩余时间和当前阶段，避免用户频繁查看外部设备。",
      "产品必须提供基础导航或首页，使用户能在 2 步内进入任一核心功能。",
      "系统必须埋点关键行为事件，包括入口曝光/点击、拍照提交、识别成功/失败、结果保存、计时启动、暂停、完成和中途退出。",
      "若首期涉及服务端存储，系统必须记录基础时间戳、用户匿名标识、功能模块和结果状态，用于后续分析。",
      "系统必须处理权限拒绝场景，对相机、相册、通知权限给出可理解的引导。",
      "系统应优先保证核心流程稳定性，高于视觉复杂度和附加功能完整度。",
      "上线前必须明确首发平台范围；若仅支持单端，PRD 与文案中必须明确说明。"
    ],
    "metrics": [
      "核心指标：首周内至少形成可观测的双功能使用数据，统计拍照热量识别使用人数占激活用户比例、组间歇计时使用人数占激活用户比例。",
      "核心指标：拍照识别成功率（成功返回结果的提交次数 / 总提交次数）达到可评审水平，建议目标 >= 70%，最终阈值待识别方案确认。",
      "核心指标：计时启动完成率（完成一次计时的次数 / 启动次数）建议 >= 60%，用于验证场景可用性。",
      "过程指标：食物拍照入口点击率、拍照提交率、结果页停留时长、结果保存率。",
      "过程指标：单次计时启动率、暂停率、中途退出率、循环计时完成率。",
      "留存指标：使用任一核心功能的新用户次日留存、7 日内二次使用率；当前无基线，上线后建立。",
      "护栏指标：识别失败率、接口超时率、计时提醒失败率、用户投诉率。",
      "护栏指标：因权限拒绝或后台限制导致的不可用比例需单独监控。"
    ],
    "risks": [
      "食物识别与热量估算准确度不足，可能导致用户快速失去信任。",
      "复杂餐盘、模糊图片、地域性食物和包装食品可能显著降低识别效果。",
      "第三方 AI 或数据库成本、调用稳定性和返回格式可能影响上线质量与预算。",
      "不同移动端对后台计时、通知提醒和震动能力限制不同，可能导致实际提醒体验不一致。",
      "若首期同时做双功能但缺少清晰导航，可能造成产品认知分散，影响转化。",
      "缺少账号与历史记录可能降低长期留存，但若提前纳入又会扩大 MVP 范围。",
      "当前缺少真实用户研究与基线数据，成功指标需要上线后动态校准。"
    ],
    "dependencies": [
      "食物识别与热量估算能力供应方，可能为第三方 AI 服务、自研模型或食物数据库。",
      "移动端系统能力，包括相机、相册、通知、音频、震动及可能的后台运行能力。",
      "首发平台决策及对应客户端研发资源配置。",
      "如需保存历史或跨设备同步，则依赖后端接口、数据存储和匿名/账号标识方案。",
      "埋点与数据看板能力，用于验证 MVP 是否成立。",
      "产品、设计、客户端、后端、测试对 MVP 范围的共同收敛。"
    ],
    "launch_plan": "建议采用灰度 + 开关控制的方式上线。第一阶段完成内部测试，重点验证拍照识别稳定性、计时提醒准确性、权限处理和埋点完整性；第二阶段针对小流量真实用户灰度发布，观察 1~2 周核心指标和护栏指标；若识别成功率、计时完成率和反馈均达到预期，再逐步放量。上线前需准备失败提示文案、免责声明、FAQ 和客服口径。若第三方识别服务不稳定或计时提醒在目标平台存在系统性缺陷，应支持快速关闭对应功能入口或降级到仅保留单一核心功能。"
  },
  "open_questions": [
    "目标用户首期优先聚焦哪一类：减脂、增肌、力量训练还是泛健身用户？",
    "首发平台是 iOS、Android，还是双端同步上线？",
    "食物热量结果是否需要支持用户手动修正、份量调整或仅展示估算值？",
    "MVP 是否必须提供历史记录，还是只验证单次使用闭环即可？",
    "食物识别返回结果采用单值还是区间展示，哪个更利于降低准确性质疑？",
    "组间歇闹钟首期是否必须支持后台运行、锁屏提醒和系统通知常驻？",
    "间歇训练模式是否纳入 MVP，还是仅保留单次组间休息倒计时？",
    "是否需要匿名用户体系或轻量账号体系来承接留存与历史数据？",
    "MVP 成功标准最终以哪些指标为主：激活后使用率、次日留存、7 日复用、还是用户主观满意度？",
    "食物热量估算的数据来源、可支持的地域食物范围和调用成本上限分别是多少？",
    "当识别结果不确定时，是否需要给出候选食物或只提示失败重试？",
    "若双核心功能同时存在，首页/导航的最简信息架构应如何设计以避免分散心智？"
  ]
}
